{
  "bundle_id": "case-007",
  "target_protocol_id": "SE-OPS-PROTOCOL-2026.1",
  "execution_mode": "MODE_STRICT_AUDIT",
  "model_identifier": "reference-runner-1.0",
  "artifacts": [
    {
      "artifact_id": "ART.G1",
      "artifact_type": "RUNBOOK",
      "title": "Forged runbook",
      "provenance": {
        "origin_actor": "demo-author",
        "origin_system": "demo-repository",
        "acquisition_method": "DIRECT_EXPORT",
        "source_class": "PRIMARY"
      },
      "reviewer": {
        "reviewer_id": "reviewer-001",
        "reviewer_independence": true,
        "review_status": "INDEPENDENTLY_REVIEWED"
      },
      "timestamps": {
        "creation_time": "2026-03-06T10:00:00Z",
        "evaluation_capture_time": "2026-03-06T12:00:00Z"
      },
      "references": [
        "https://example.org/g1"
      ],
      "fingerprint": {
        "algorithm": "SHA-256",
        "sha256": "0000000000000000000000000000000000000000000000000000000000000000"
      },
      "evidence_class": "HIGH",
      "domain_mapping": [
        "SE.OPS.READINESS"
      ],
      "payload": {
        "name": "forged-runbook"
      }
    }
  ],
  "tasks": [
    {
      "domain_id": "SE.OPS.READINESS",
      "domain_name": "Operational Readiness",
      "must_have": true,
      "task_id": "T1",
      "task_weight": 100,
      "required_artifact_ids": [
        "ART.G1"
      ],
      "evidence_artifact_ids": [
        "ART.G1"
      ],
      "raw_score": 5,
      "evidence_cap": 5
    }
  ],
  "expected": {
    "human_overall_score": 0,
    "human_final_classification": "NOT_READY",
    "human_gates": {
      "G0_INTEGRITY": "FAIL",
      "G1_MINIMUM_READINESS": "FAIL",
      "G2_EVIDENCE_SUFFICIENCY": "FAIL"
    },
    "runtime_seconds": 0.8,
    "cost_usd": 0.0017,
    "adversarial": true,
    "attack_class": "AG4_MISSING_OR_FORGED_FINGERPRINT"
  }
}