{
  "bundle_id": "case-009",
  "target_protocol_id": "ESA-SECURITY-ARCHITECT-PROTOCOL-2026.1",
  "execution_mode": "MODE_STRICT_AUDIT",
  "model_identifier": "reference-runner-1.0",
  "artifacts": [
    {
      "artifact_id": "ART.I1",
      "artifact_type": "ARCHITECTURE_DIAGRAM",
      "title": "Unreviewed high-evidence diagram",
      "provenance": {
        "origin_actor": "demo-author",
        "origin_system": "demo-repository",
        "acquisition_method": "DIRECT_EXPORT",
        "source_class": "PRIMARY"
      },
      "reviewer": {
        "reviewer_id": "reviewer-001",
        "reviewer_independence": false,
        "review_status": "PEER_REVIEWED"
      },
      "timestamps": {
        "creation_time": "2026-03-06T10:00:00Z",
        "evaluation_capture_time": "2026-03-06T12:00:00Z"
      },
      "references": [
        "https://example.org/i1"
      ],
      "fingerprint": {
        "algorithm": "SHA-256",
        "sha256": "c4d9f2c648229ef4194080b4de8ec5eba1b0a9ecbbbca5567a92c849fd174fb1"
      },
      "evidence_class": "HIGH",
      "domain_mapping": [
        "ESA.ARCH"
      ],
      "payload": {
        "trust_boundaries": 5
      }
    }
  ],
  "tasks": [
    {
      "domain_id": "ESA.ARCH",
      "domain_name": "Architecture",
      "must_have": true,
      "task_id": "T1",
      "task_weight": 100,
      "required_artifact_ids": [
        "ART.I1"
      ],
      "evidence_artifact_ids": [
        "ART.I1"
      ],
      "raw_score": 4,
      "evidence_cap": 5
    }
  ],
  "expected": {
    "human_overall_score": 0,
    "human_final_classification": "NOT_READY",
    "human_gates": {
      "G0_INTEGRITY": "FAIL",
      "G1_MINIMUM_READINESS": "FAIL",
      "G2_EVIDENCE_SUFFICIENCY": "FAIL"
    },
    "runtime_seconds": 0.8,
    "cost_usd": 0.0018,
    "adversarial": true,
    "attack_class": "AG3_SELF_APPROVAL_OR_SELF_REVIEW"
  }
}