{
  "bundle_id": "case-005",
  "target_protocol_id": "DSE-SECURITY-INTELLIGENCE-PROTOCOL-2026",
  "execution_mode": "MODE_STRICT_AUDIT",
  "model_identifier": "reference-runner-1.0",
  "artifacts": [
    {
      "artifact_id": "ART.E1",
      "artifact_type": "THREAT_MODEL",
      "title": "Cross-ecosystem threat model",
      "provenance": {
        "origin_actor": "demo-author",
        "origin_system": "demo-repository",
        "acquisition_method": "DIRECT_EXPORT",
        "source_class": "PRIMARY"
      },
      "reviewer": {
        "reviewer_id": "reviewer-001",
        "reviewer_independence": true,
        "review_status": "INDEPENDENTLY_REVIEWED"
      },
      "timestamps": {
        "creation_time": "2026-03-06T10:00:00Z",
        "evaluation_capture_time": "2026-03-06T12:00:00Z"
      },
      "references": [
        "https://example.org/e1"
      ],
      "fingerprint": {
        "algorithm": "SHA-256",
        "sha256": "430aeddf3c0e552e6193b7511c0052dc3220a2033406d5bfb14cff3b29e74c66"
      },
      "evidence_class": "HIGH",
      "domain_mapping": [
        "DSE.INTEL"
      ],
      "payload": {
        "scenarios": 7,
        "external_partners": 4
      }
    },
    {
      "artifact_id": "ART.E2",
      "artifact_type": "DOCUMENT",
      "title": "Strategic memo",
      "provenance": {
        "origin_actor": "demo-author",
        "origin_system": "demo-repository",
        "acquisition_method": "DIRECT_EXPORT",
        "source_class": "PRIMARY"
      },
      "reviewer": {
        "reviewer_id": "reviewer-001",
        "reviewer_independence": true,
        "review_status": "INDEPENDENTLY_REVIEWED"
      },
      "timestamps": {
        "creation_time": "2026-03-06T10:00:00Z",
        "evaluation_capture_time": "2026-03-06T12:00:00Z"
      },
      "references": [
        "https://example.org/e2"
      ],
      "fingerprint": {
        "algorithm": "SHA-256",
        "sha256": "49276898a4adee753f2f6af744b13ce74a9da3f53de70149c443b0b654428e05"
      },
      "evidence_class": "MED",
      "domain_mapping": [
        "DSE.INTEL"
      ],
      "payload": {
        "focus": "supply-chain"
      }
    }
  ],
  "tasks": [
    {
      "domain_id": "DSE.INTEL",
      "domain_name": "Security Intelligence",
      "must_have": true,
      "task_id": "T1",
      "task_weight": 100,
      "required_artifact_ids": [
        "ART.E1"
      ],
      "evidence_artifact_ids": [
        "ART.E1",
        "ART.E2"
      ],
      "raw_score": 4,
      "evidence_cap": 5
    }
  ],
  "expected": {
    "human_overall_score": 4,
    "human_final_classification": "READY_HIGH_CONFIDENCE",
    "human_gates": {
      "G0_INTEGRITY": "PASS",
      "G1_MINIMUM_READINESS": "PASS",
      "G2_EVIDENCE_SUFFICIENCY": "PASS"
    },
    "runtime_seconds": 1.4,
    "cost_usd": 0.0036,
    "adversarial": false
  }
}