{
  "bundle_id": "worked-example-se-001",
  "target_protocol_id": "SE-OPS-PROTOCOL-2026.1",
  "execution_mode": "MODE_STRICT_AUDIT",
  "model_identifier": "reference-runner-1.0",
  "artifacts": [
    {
      "artifact_id": "ART.RUNBOOK.IDENTITY.001",
      "artifact_type": "RUNBOOK",
      "title": "Identity incident runbook",
      "provenance": {
        "origin_actor": "demo-author",
        "origin_system": "demo-repository",
        "acquisition_method": "DIRECT_EXPORT",
        "source_class": "PRIMARY"
      },
      "reviewer": {
        "reviewer_id": "reviewer-001",
        "reviewer_independence": true,
        "review_status": "INDEPENDENTLY_REVIEWED"
      },
      "timestamps": {
        "creation_time": "2026-03-06T10:00:00Z",
        "evaluation_capture_time": "2026-03-06T12:00:00Z"
      },
      "references": [
        "https://example.org/art.runbook.identity.001"
      ],
      "fingerprint": {
        "algorithm": "SHA-256",
        "sha256": "30554a83551b4cfa61d0f4b6e5aff2b4e9a36aee05cee48ac9453a03f4cfc0fc"
      },
      "evidence_class": "HIGH",
      "domain_mapping": [
        "SE.OPS.READINESS"
      ],
      "payload": {
        "owner": "secops",
        "service": "identity",
        "steps": [
          "triage",
          "contain",
          "recover"
        ]
      }
    },
    {
      "artifact_id": "ART.METRICS.IDENTITY.001",
      "artifact_type": "METRICS_SNAPSHOT",
      "title": "Identity alert metrics",
      "provenance": {
        "origin_actor": "demo-author",
        "origin_system": "demo-repository",
        "acquisition_method": "DIRECT_EXPORT",
        "source_class": "PRIMARY"
      },
      "reviewer": {
        "reviewer_id": "reviewer-001",
        "reviewer_independence": true,
        "review_status": "INDEPENDENTLY_REVIEWED"
      },
      "timestamps": {
        "creation_time": "2026-03-06T10:00:00Z",
        "evaluation_capture_time": "2026-03-06T12:00:00Z"
      },
      "references": [
        "https://example.org/art.metrics.identity.001"
      ],
      "fingerprint": {
        "algorithm": "SHA-256",
        "sha256": "3b14d8556ea2cac3f02aa20ae1a270413a08aa1a4842822d6890b42fa35b3994"
      },
      "evidence_class": "MED",
      "domain_mapping": [
        "SE.OPS.MONITORING"
      ],
      "payload": {
        "mttr_minutes": 42,
        "false_positive_rate": 0.06,
        "coverage": "identity-prod"
      }
    },
    {
      "artifact_id": "ART.INCIDENT.IDENTITY.001",
      "artifact_type": "INCIDENT_REPORT",
      "title": "Identity incident report",
      "provenance": {
        "origin_actor": "demo-author",
        "origin_system": "demo-repository",
        "acquisition_method": "DIRECT_EXPORT",
        "source_class": "PRIMARY"
      },
      "reviewer": {
        "reviewer_id": "reviewer-001",
        "reviewer_independence": true,
        "review_status": "INDEPENDENTLY_REVIEWED"
      },
      "timestamps": {
        "creation_time": "2026-03-06T10:00:00Z",
        "evaluation_capture_time": "2026-03-06T12:00:00Z"
      },
      "references": [
        "https://example.org/art.incident.identity.001"
      ],
      "fingerprint": {
        "algorithm": "SHA-256",
        "sha256": "996f6a156c22874e30465507dbcb890b9bf08cd828ea1bb7442fdc44558a3147"
      },
      "evidence_class": "HIGH",
      "domain_mapping": [
        "SE.OPS.IR"
      ],
      "payload": {
        "incident_id": "INC-2026-001",
        "severity": "sev2",
        "rca": "expired signing key",
        "lessons": [
          "rotate earlier",
          "add monitor"
        ]
      }
    }
  ],
  "tasks": [
    {
      "domain_id": "SE.OPS.READINESS",
      "domain_name": "Operational Readiness",
      "must_have": true,
      "task_id": "SE.OPS.READINESS.T1",
      "task_weight": 40,
      "required_artifact_ids": [
        "ART.RUNBOOK.IDENTITY.001"
      ],
      "evidence_artifact_ids": [
        "ART.RUNBOOK.IDENTITY.001"
      ],
      "raw_score": 4,
      "evidence_cap": 5
    },
    {
      "domain_id": "SE.OPS.MONITORING",
      "domain_name": "Monitoring and Metrics",
      "must_have": true,
      "task_id": "SE.OPS.MONITORING.T1",
      "task_weight": 30,
      "required_artifact_ids": [
        "ART.METRICS.IDENTITY.001"
      ],
      "evidence_artifact_ids": [
        "ART.METRICS.IDENTITY.001"
      ],
      "raw_score": 4,
      "evidence_cap": 4
    },
    {
      "domain_id": "SE.OPS.IR",
      "domain_name": "Incident Response",
      "must_have": true,
      "task_id": "SE.OPS.IR.T1",
      "task_weight": 30,
      "required_artifact_ids": [
        "ART.INCIDENT.IDENTITY.001"
      ],
      "evidence_artifact_ids": [
        "ART.INCIDENT.IDENTITY.001"
      ],
      "raw_score": 5,
      "evidence_cap": 5
    }
  ],
  "notes": "Worked example for end-to-end execution."
}